{
 "schema_version": "1.0",
 "as_of": "2026-10",
 "nodes": [
  {
   "id": "multi-s0-cobalt-drc",
   "chemistries": [
    "nmc",
    "ni-h2"
   ],
   "stage": "S0",
   "kind": "share",
   "name": "Cobalt mining, DRC",
   "country": "CD",
   "role": "73% of world cobalt mine output (2025)",
   "share": {
    "country": "CD",
    "percent": 73,
    "metric": "mine output"
   },
   "values": [
    {
     "value": 73,
     "claim": "DRC 73%, Indonesia 14% of 2025 mine output; export quotas up to 96,600 t/yr in 2026–27",
     "sources": [
      "src-usgs-mcs-2026"
     ],
     "tier": "T1",
     "tag": "OS",
     "as_of": "2026-10"
    }
   ],
   "confidence": "High",
   "confidence_reason": "Grade A: USGS MCS 2026",
   "flags": [],
   "policy": [],
   "ethical_risks": [
    {
     "category": "LR-CL",
     "signal": "documented-harm",
     "material": "cobalt",
     "evidence": "Children and adults in hazardous artisanal cobalt mining (DOL; Amnesty 2016)",
     "sources": [
      "src-dol-tvpra-2024",
      "src-amnesty-2016"
     ],
     "assurance": "rmi-rmap-conformant",
     "eu_dd_coverage": "covered",
     "confidence": "High",
     "confidence_reason": "Grade-A government finding corroborated by NGO field research",
     "as_of": "2026-10",
     "assurance_detail": "RMI cobalt refiners list exists",
     "has_independent_source": true
    },
    {
     "category": "LR-FL",
     "signal": "documented-harm",
     "material": "cobalt",
     "evidence": "Forced-labour indicators among cobalt workers: hazardous work, withheld wages, debt-like dependence (DOL)",
     "sources": [
      "src-dol-tvpra-2024"
     ],
     "assurance": "rmi-rmap-conformant",
     "eu_dd_coverage": "covered",
     "confidence": "High",
     "confidence_reason": "Grade-A government finding",
     "as_of": "2026-10",
     "assurance_detail": "RMI cobalt refiners list exists",
     "has_independent_source": false
    },
    {
     "category": "COM",
     "signal": "documented-harm",
     "material": "cobalt",
     "evidence": "Amnesty International and IBGDH documented forced evictions with reported sexual assault, arson and beatings during industrial mine expansion near Kolwezi",
     "sources": [
      "src-amnesty-2023"
     ],
     "assurance": "none-known",
     "eu_dd_coverage": "covered",
     "confidence": "Medium",
     "confidence_reason": "Single NGO investigation (130+ interviews)",
     "as_of": "2026-10",
     "has_independent_source": true,
     "gender_note": true
    }
   ],
   "as_of": "2026-10",
   "research_note": "research/nmc-reference.md"
  },
  {
   "id": "multi-s0-nickel-indonesia",
   "chemistries": [
    "nmc",
    "ni-h2"
   ],
   "stage": "S0",
   "kind": "share",
   "name": "Nickel mining and HPAL processing, Indonesia",
   "country": "ID",
   "role": "≈60% of mined nickel; ≈45% of processing (2024)",
   "share": {
    "country": "ID",
    "percent": 60,
    "metric": "mined supply"
   },
   "values": [
    {
     "value": 60,
     "claim": "Indonesia supplied 60% of mined nickel and processed almost 45% (2024)",
     "sources": [
      "src-iea-gcmo-2025"
     ],
     "tier": "T2",
     "tag": "OS",
     "as_of": "2026-10"
    }
   ],
   "confidence": "Medium",
   "confidence_reason": "Single grade-B source (IEA)",
   "flags": [],
   "policy": [
    {
     "instrument": "sulphuric-acid",
     "effect": "Processing depends on sulphuric acid; Hormuz/China export shocks raised costs",
     "status": "Easing in Q3 2026; re-disruption risk; a UFLPA-listed miner (Zijin, Jan 2025) is cited for XUAR sulphuric acid",
     "sources": [
      "src-benchmark-acid",
      "src-fr-2025-00901"
     ],
     "as_of": "2026-10-05"
    }
   ],
   "ethical_risks": [
    {
     "category": "LR-FL",
     "signal": "documented-harm",
     "material": "nickel",
     "evidence": "Forced labour in nickel production: deceptive recruitment, withheld passports (DOL)",
     "sources": [
      "src-dol-tvpra-2024"
     ],
     "assurance": "none-known",
     "eu_dd_coverage": "covered",
     "confidence": "High",
     "confidence_reason": "Grade-A government finding",
     "as_of": "2026-10",
     "assurance_detail": "IRMA: Harita and Sorowako in assessment; no published level",
     "has_independent_source": false
    },
    {
     "category": "COM",
     "signal": "documented-harm",
     "material": "nickel",
     "evidence": "Climate Rights International documented pollution, lost livelihoods, land grabbing and threats to Indigenous ways of life (93 interviews)",
     "sources": [
      "src-cri-2025",
      "src-cri-2024"
     ],
     "assurance": "none-known",
     "eu_dd_coverage": "covered",
     "confidence": "High",
     "confidence_reason": "Two independent CRI investigations agree",
     "as_of": "2026-10",
     "has_independent_source": true
    },
    {
     "category": "ENV-S",
     "signal": "documented-harm",
     "material": "nickel",
     "evidence": "Earthworks and Mongabay report HPAL filtered-tailings facilities that are overfilled and unstable, worker deaths, and seepage contamination",
     "sources": [
      "src-earthworks-2026",
      "src-mongabay-2026-ni"
     ],
     "assurance": "none-known",
     "eu_dd_coverage": "covered",
     "confidence": "High",
     "confidence_reason": "Two independent sources",
     "as_of": "2026-10",
     "has_independent_source": true
    },
    {
     "category": "LR-DIS",
     "signal": "documented-harm",
     "material": "nickel",
     "evidence": "Climate Rights International documented discrimination, harassment and reproductive-health risks faced by women workers at IMIP",
     "sources": [
      "src-cri-2025"
     ],
     "assurance": "none-known",
     "eu_dd_coverage": "covered",
     "confidence": "Medium",
     "confidence_reason": "Single NGO investigation",
     "as_of": "2026-10",
     "has_independent_source": true,
     "gender_note": true
    }
   ],
   "as_of": "2026-10",
   "research_note": "research/harm-evidence.md"
  },
  {
   "id": "multi-s0-lithium-mining",
   "chemistries": [
    "nmc",
    "lfp",
    "lmfp"
   ],
   "stage": "S0",
   "kind": "share",
   "name": "Lithium mining (global)",
   "country": "MULTI",
   "role": "Australia, China, Chile, Zimbabwe, Argentina lead (2025)",
   "share": null,
   "values": [
    {
     "claim": "2025 mine output: Australia 92 kt, China 62 kt, Chile 56 kt, Zimbabwe 28 kt, Argentina 23 kt",
     "sources": [
      "src-usgs-mcs-2026"
     ],
     "tier": "T1",
     "tag": "OS",
     "as_of": "2026-10"
    }
   ],
   "confidence": "High",
   "confidence_reason": "Grade A: USGS MCS 2026",
   "flags": [],
   "policy": [],
   "ethical_risks": [
    {
     "category": "ENV-W",
     "signal": "documented-harm",
     "material": "lithium",
     "evidence": "Peer-reviewed studies link brine extraction in the Salar de Atacama to water injustice for Atacameño communities (magnitude contested)",
     "sources": [
      "src-slca-atacama-2024",
      "src-atacama-water-justice"
     ],
     "assurance": "irma-audit",
     "eu_dd_coverage": "covered",
     "confidence": "High",
     "confidence_reason": "Two peer-reviewed sources agree that the concern is documented",
     "as_of": "2026-10",
     "assurance_detail": "IRMA: Salar de Atacama sites audited",
     "has_independent_source": true
    },
    {
     "category": "LR-CL",
     "signal": "documented-harm",
     "material": "lithium",
     "evidence": "Children in artisanal lithium mining in Zimbabwe (DOL)",
     "sources": [
      "src-dol-tvpra-2024"
     ],
     "assurance": "none-known",
     "eu_dd_coverage": "covered",
     "confidence": "High",
     "confidence_reason": "Grade-A government finding",
     "as_of": "2026-10",
     "has_independent_source": false
    },
    {
     "category": "HR",
     "signal": "documented-harm",
     "material": "lithium",
     "evidence": "Global Witness documented corruption red flags and mining without environmental assessment (Zimbabwe, Namibia, DRC)",
     "sources": [
      "src-gw-2023"
     ],
     "assurance": "none-known",
     "eu_dd_coverage": "covered",
     "confidence": "Medium",
     "confidence_reason": "Single investigation",
     "as_of": "2026-10",
     "has_independent_source": true
    }
   ],
   "as_of": "2026-10",
   "research_note": "research/harm-evidence.md"
  },
  {
   "id": "multi-s1-lithium-xinjiang",
   "chemistries": [
    "nmc",
    "lfp",
    "lmfp"
   ],
   "stage": "S1",
   "kind": "entity",
   "name": "Xinjiang lithium processing (SDIC Xinjiang Lithium; Xinjiang Asia-Europe Rare Metal)",
   "country": "CN",
   "role": "Lithium carbonate from Lop Nur brine; largest XUAR lithium company",
   "share": null,
   "values": [
    {
     "claim": "SDIC Xinjiang Lithium produces lithium carbonate from Lop Nur salt-lake brine (UFLPA notice)",
     "sources": [
      "src-fr-2026-15628"
     ],
     "tier": "T1",
     "tag": "OS",
     "as_of": "2026-10"
    },
    {
     "claim": "Xinjiang Asia-Europe Rare Metal has received 'assigned' workers since at least 2017",
     "sources": [
      "src-shu-driving-force"
     ],
     "tier": "T2",
     "tag": "OS",
     "as_of": "2026-10"
    }
   ],
   "confidence": "High",
   "confidence_reason": "Grade-A official listing plus academic documentation",
   "flags": [
    {
     "type": "uflpa-entity-list",
     "source": "src-fr-2026-15628",
     "basis": "SDIC Xinjiang Lithium sources lithium from Lop Nur brine in the XUAR (criterion 2(d)(2)(B)(v))",
     "official_list": true,
     "label": "UFLPA Entity List (US DHS): screening result, not a finding of documented harm",
     "as_of": "2026-10"
    }
   ],
   "policy": [],
   "ethical_risks": [
    {
     "category": "LR-FL",
     "signal": "documented-harm",
     "material": "lithium",
     "evidence": "Sheffield Hallam University (Driving Force) documented state labour transfers at the largest XUAR lithium company",
     "sources": [
      "src-shu-driving-force"
     ],
     "assurance": "none-known",